id,date,version,score,content,preprocessed-content,upvote,reply,reply_date
17362,2019-04-21 12:39:03,5.4.1,3,"Used to love ThredUp, but they've made two changes that make it hard to love them 1) They no longer include measurements for items. Everyone knows that size numbers and S, M, L mean nothing; without actual measurements I end up returning twice as many items. 2) They started charging a ""restocking fee"" for most items if you return them. These two policies make it difficult to love ThredUp. :(",use love thredup they've make two change make hard love 1 long include measurement item everyone know size number l mean nothing without actual measurement end return twice many item 2 start charge restock fee item return two policy make difficult love thredup,203,"Hi Deborah! Thank you for sharing your thoughts on these topics, we will be sure to pass your feedback along. While there have been some recent changes at thredUP, we are trying to improve the overall customer experience in the long run! We hope you will continue shopping with us & are happy to chat further over at support@thredup.com.",2019-04-24 18:42:34
15621,2019-08-30 22:38:06,5.4.17,1,Sent a huge bag of clothes some still with tags on and at the end only made $3.83!! The site is difficult to navigate. They make you pay to reclaim your items that didn't sell by expiration date. Not worth the trouble and I won't be using anymore.,sent huge bag clothes still tags end make 383 site difficult navigate make pay reclaim item didn't sell expiration date worth trouble wont use anymore,201,thredUP is the most convenient way to clean out your closet and find new homes for items you’re no longer loving. We're sorry that you didn't earn as much as you had in mind. Our support team is always happy to address any questions or concerns you may have via direct messaging in the app or over email at app-support@thredup.com.,2019-09-04 17:42:21
16194,2019-07-19 23:00:25,5.4.10,1,"My concerns have been ignored multiple times. I have reached out to them 7/15 via chat and they keep closing down my messages without any acknowledgement. I'm still trying to contact them until now 7/19 even via email, chat, & messenger and there's still no response or any kind of resolution to the questions I have sent!!!!! Extremely disappointed with Customer Support. This doesn't feel like you actually care about customers' concerns at all! AND I STILL DON'T HAVE MY REFUND!!!",concern ignore multiple time reach 715 via chat keep closing message without acknowledgement i still try contact 719 even via email chat messenger there still response kind resolution question send extremely disappointed customer support doesn't feel like actually care customer concern still don't refund,183,We sincerely apologize that you had some trouble connecting with our support team. A recent switch to a new communication platform created a backlog of inquiries that our team is working through as quickly as possible. Please send an email to app-support@thredup.com if you are still needing assistance. Thanks so much for your patience.,2019-07-24 16:10:18
7796,2021-04-17 17:26:43,5.11.2,5,"I love to thrift, and I originally got this just to see how it was, as I saw a lot of ads in Instagram, but I ended up loving it. I just made my 3rd purchase. There are some amazing finds, but like any thrifting you may have to search for a while. I'd like to note, that sadly they don't carry men's clothes, which hopefully will change one day, as I love getting my fiance Hawaiian shirts, and I do find the best at thrift stores",love thrift originally get see saw lot ad instagram end loving make and purchase amazing find like drifting may search id like note sadly don't carry men clothes hopefully change one day love get finance hawaiian shirt find best thrift store,182,,None
18308,2019-02-12 4:12:32,5.3.2,1,"Do not order ANYTHING from this company. When I placed my first order, they never gave me a chance to create or modify a shipping address. I clicked on google pay and the order got placed to an incorrect address. When I emailed Thredup immediately after placing an order, they never replied, then they took my money and continued to ship it to the wrong address. Now I am attempting to block the shipment through fedex and am going to my bank to explain this was an unauthorized transaction.",order anything company place first order never give chance create modify ship address click googly pay order get place incorrect address email thredup immediately place order never reply take money continue ship wrong address attempt block shipment feel go bank explain unauthorized transaction,179,"Hi Jill. We're sorry about this experience. Our team follows up with emails in about 24-48 hours. If you're in need of further assistance, you can also reach our team immediately via live chat or through our Twitter Support channel. Thank you.",2019-02-21 16:39:41
